{
    "$schema": "http://json-schema.org/schema#",
    "properties": {
        "abilities": {
            "items": {
                "properties": {
                    "ability": {
                        "properties": {
                            "name": {
                                "type": "string"
                            },
                            "url": {
                                "type": "string"
                            }
                        },
                        "required": [
                            "name",
                            "url"
                        ],
                        "type": "object"
                    },
                    "is_hidden": {
                        "type": "boolean"
                    },
                    "slot": {
                        "type": "integer"
                    }
                },
                "required": [
                    "ability",
                    "is_hidden",
                    "slot"
                ],
                "type": "object"
            },
            "type": "array"
        },
        "base_experience": {
            "type": "integer"
        },
        "forms": {
            "items": {
                "properties": {
                    "name": {
                        "type": "string"
                    },
                    "url": {
                        "type": "string"
                    }
                },
                "required": [
                    "name",
                    "url"
                ],
                "type": "object"
            },
            "type": "array"
        },
        "game_indices": {
            "items": {
                "properties": {
                    "game_index": {
                        "type": "integer"
                    },
                    "version": {
                        "properties": {
                            "name": {
                                "type": "string"
                            },
                            "url": {
                                "type": "string"
                            }
                        },
                        "required": [
                            "name",
                            "url"
                        ],
                        "type": "object"
                    }
                },
                "required": [
                    "game_index",
                    "version"
                ],
                "type": "object"
            },
            "type": "array"
        },
        "height": {
            "type": "integer"
        },
        "held_items": {
            "items": {
                "properties": {
                    "item": {
                        "properties": {
                            "name": {
                                "type": "string"
                            },
                            "url": {
                                "type": "string"
                            }
                        },
                        "required": [
                            "name",
                            "url"
                        ],
                        "type": "object"
                    },
                    "version_details": {
                        "items": {
                            "properties": {
                                "rarity": {
                                    "type": "integer"
                                },
                                "version": {
                                    "properties": {
                                        "name": {
                                            "type": "string"
                                        },
                                        "url": {
                                            "type": "string"
                                        }
                                    },
                                    "required": [
                                        "name",
                                        "url"
                                    ],
                                    "type": "object"
                                }
                            },
                            "required": [
                                "rarity",
                                "version"
                            ],
                            "type": "object"
                        },
                        "type": "array"
                    }
                },
                "required": [
                    "item",
                    "version_details"
                ],
                "type": "object"
            },
            "type": "array"
        },
        "id": {
            "type": "integer"
        },
        "is_default": {
            "type": "boolean"
        },
        "location_area_encounters": {
            "type": "string"
        },
        "moves": {
            "items": {
                "properties": {
                    "move": {
                        "properties": {
                            "name": {
                                "type": "string"
                            },
                            "url": {
                                "type": "string"
                            }
                        },
                        "required": [
                            "name",
                            "url"
                        ],
                        "type": "object"
                    },
                    "version_group_details": {
                        "items": {
                            "properties": {
                                "level_learned_at": {
                                    "type": "integer"
                                },
                                "move_learn_method": {
                                    "properties": {
                                        "name": {
                                            "type": "string"
                                        },
                                        "url": {
                                            "type": "string"
                                        }
                                    },
                                    "required": [
                                        "name",
                                        "url"
                                    ],
                                    "type": "object"
                                },
                                "version_group": {
                                    "properties": {
                                        "name": {
                                            "type": "string"
                                        },
                                        "url": {
                                            "type": "string"
                                        }
                                    },
                                    "required": [
                                        "name",
                                        "url"
                                    ],
                                    "type": "object"
                                }
                            },
                            "required": [
                                "level_learned_at",
                                "move_learn_method",
                                "version_group"
                            ],
                            "type": "object"
                        },
                        "type": "array"
                    }
                },
                "required": [
                    "move",
                    "version_group_details"
                ],
                "type": "object"
            },
            "type": "array"
        },
        "name": {
            "type": "string"
        },
        "order": {
            "type": "integer"
        },
        "species": {
            "properties": {
                "name": {
                    "type": "string"
                },
                "url": {
                    "type": "string"
                }
            },
            "required": [
                "name",
                "url"
            ],
            "type": "object"
        },
        "sprites": {
            "properties": {
                "back_default": {
                    "type": [
                        "null",
                        "string"
                    ]
                },
                "back_female": {
                    "type": [
                        "null",
                        "string"
                    ]
                },
                "back_shiny": {
                    "type": [
                        "null",
                        "string"
                    ]
                },
                "back_shiny_female": {
                    "type": [
                        "null",
                        "string"
                    ]
                },
                "front_default": {
                    "type": [
                        "null",
                        "string"
                    ]
                },
                "front_female": {
                    "type": [
                        "null",
                        "string"
                    ]
                },
                "front_shiny": {
                    "type": [
                        "null",
                        "string"
                    ]
                },
                "front_shiny_female": {
                    "type": [
                        "null",
                        "string"
                    ]
                }
            },
            "required": [
                "back_default",
                "back_female",
                "back_shiny",
                "back_shiny_female",
                "front_default",
                "front_female",
                "front_shiny",
                "front_shiny_female"
            ],
            "type": "object"
        },
        "stats": {
            "items": {
                "properties": {
                    "base_stat": {
                        "type": "integer"
                    },
                    "effort": {
                        "type": "integer"
                    },
                    "stat": {
                        "properties": {
                            "name": {
                                "type": "string"
                            },
                            "url": {
                                "type": "string"
                            }
                        },
                        "required": [
                            "name",
                            "url"
                        ],
                        "type": "object"
                    }
                },
                "required": [
                    "base_stat",
                    "effort",
                    "stat"
                ],
                "type": "object"
            },
            "type": "array"
        },
        "types": {
            "items": {
                "properties": {
                    "slot": {
                        "type": "integer"
                    },
                    "type": {
                        "properties": {
                            "name": {
                                "type": "string"
                            },
                            "url": {
                                "type": "string"
                            }
                        },
                        "required": [
                            "name",
                            "url"
                        ],
                        "type": "object"
                    }
                },
                "required": [
                    "slot",
                    "type"
                ],
                "type": "object"
            },
            "type": "array"
        },
        "weight": {
            "type": "integer"
        }
    },
    "required": [
        "abilities",
        "base_experience",
        "forms",
        "game_indices",
        "height",
        "held_items",
        "id",
        "is_default",
        "location_area_encounters",
        "moves",
        "name",
        "order",
        "species",
        "sprites",
        "stats",
        "types",
        "weight"
    ],
    "type": "object"
}