{
    "abilities": [
        {
            "ability": {
                "name": "delta-stream",
                "url": "http://localhost/api/v2/ability/191/"
            },
            "is_hidden": false,
            "slot": 1
        }
    ],
    "base_experience": 351,
    "forms": [
        {
            "name": "rayquaza-mega",
            "url": "http://localhost/api/v2/pokemon-form/10181/"
        }
    ],
    "game_indices": [
        {
            "game_index": 814,
            "version": {
                "name": "omega-ruby",
                "url": "http://localhost/api/v2/version/25/"
            }
        }
    ],
    "height": 108,
    "held_items": [],
    "id": 10079,
    "is_default": false,
    "location_area_encounters": "/api/v2/pokemon/10079/encounters",
    "moves": [
        {
            "move": {
                "name": "swords-dance",
                "url": "http://localhost/api/v2/move/14/"
            },
            "version_group_details": [
                {
                    "level_learned_at": 0,
                    "move_learn_method": {
                        "name": "machine",
                        "url": "http://localhost/api/v2/move-learn-method/4/"
                    },
                    "version_group": {
                        "name": "sun-moon",
                        "url": "http://localhost/api/v2/version-group/17/"
                    }
                },
                {
                    "level_learned_at": 0,
                    "move_learn_method": {
                        "name": "machine",
                        "url": "http://localhost/api/v2/move-learn-method/4/"
                    },
                    "version_group": {
                        "name": "omega-ruby-alpha-sapphire",
                        "url": "http://localhost/api/v2/version-group/16/"
                    }
                }
            ]
        },
        {
            "move": {
                "name": "fly",
                "url": "http://localhost/api/v2/move/19/"
            },
            "version_group_details": [
                {
                    "level_learned_at": 0,
                    "move_learn_method": {
                        "name": "machine",
                        "url": "http://localhost/api/v2/move-learn-method/4/"
                    },
                    "version_group": {
                        "name": "sun-moon",
                        "url": "http://localhost/api/v2/version-group/17/"
                    }
                },
                {
                    "level_learned_at": 65,
                    "move_learn_method": {
                        "name": "level-up",
                        "url": "http://localhost/api/v2/move-learn-method/1/"
                    },
                    "version_group": {
                        "name": "sun-moon",
                        "url": "http://localhost/api/v2/version-group/17/"
                    }
                },
                {
                    "level_learned_at": 0,
                    "move_learn_method": {
                        "name": "machine",
                        "url": "http://localhost/api/v2/move-learn-method/4/"
                    },
                    "version_group": {
                        "name": "omega-ruby-alpha-sapphire",
                        "url": "http://localhost/api/v2/version-group/16/"
                    }
                },
                {
                    "level_learned_at": 65,
                    "move_learn_method": {
                        "name": "level-up",
                        "url": "http://localhost/api/v2/move-learn-method/1/"
                    },
                    "version_group": {
                        "name": "omega-ruby-alpha-sapphire",
                        "url": "http://localhost/api/v2/version-group/16/"
                    }
                }
            ]
        },
        {
            "move": {
                "name": "bind",
                "url": "http://localhost/api/v2/move/20/"
            },
            "version_group_details": [
                {
                    "level_learned_at": 0,
                    "move_learn_method": {
                        "name": "tutor",
                        "url": "http://localhost/api/v2/move-learn-method/3/"
                    },
                    "version_group": {
                        "name": "omega-ruby-alpha-sapphire",
                        "url": "http://localhost/api/v2/version-group/16/"
                    }
                }
            ]
        },
        {
            "move": {
                "name": "roar",
                "url": "http://localhost/api/v2/move/46/"
            },
            "version_group_details": [
                {
                    "level_learned_at": 0,
                    "move_learn_method": {
                        "name": "machine",
                        "url": "http://localhost/api/v2/move-learn-method/4/"
                    },
                    "version_group": {
                        "name": "sun-moon",
                        "url": "http://localhost/api/v2/version-group/17/"
                    }
                },
                {
                    "level_learned_at": 0,
                    "move_learn_method": {
                        "name": "machine",
                        "url": "http://localhost/api/v2/move-learn-method/4/"
                    },
                    "version_group": {
                        "name": "omega-ruby-alpha-sapphire",
                        "url": "http://localhost/api/v2/version-group/16/"
                    }
                }
            ]
        },
        {
            "move": {
                "name": "flamethrower",
                "url": "http://localhost/api/v2/move/53/"
            },
            "version_group_details": [
                {
                    "level_learned_at": 0,
                    "move_learn_method": {
                        "name": "machine",
                        "url": "http://localhost/api/v2/move-learn-method/4/"
                    },
                    "version_group": {
                        "name": "sun-moon",
                        "url": "http://localhost/api/v2/version-group/17/"
                    }
                },
                {
                    "level_learned_at": 0,
                    "move_learn_method": {
                        "name": "machine",
                        "url": "http://localhost/api/v2/move-learn-method/4/"
                    },
                    "version_group": {
                        "name": "omega-ruby-alpha-sapphire",
                        "url": "http://localhost/api/v2/version-group/16/"
                    }
                }
            ]
        },
        {
            "move": {
                "name": "surf",
                "url": "http://localhost/api/v2/move/57/"
            },
            "version_group_details": [
                {
                    "level_learned_at": 0,
                    "move_learn_method": {
                        "name": "machine",
                        "url": "http://localhost/api/v2/move-learn-method/4/"
                    },
                    "version_group": {
                        "name": "sun-moon",
                        "url": "http://localhost/api/v2/version-group/17/"
                    }
                },
                {
                    "level_learned_at": 0,
                    "move_learn_method": {
                        "name": "machine",
                        "url": "http://localhost/api/v2/move-learn-method/4/"
                    },
                    "version_group": {
                        "name": "omega-ruby-alpha-sapphire",
                        "url": "http://localhost/api/v2/version-group/16/"
                    }
                }
            ]
        },
        {
            "move": {
                "name": "ice-beam",
                "url": "http://localhost/api/v2/move/58/"
            },
            "version_group_details": [
                {
                    "level_learned_at": 0,
                    "move_learn_method": {
                        "name": "machine",
                        "url": "http://localhost/api/v2/move-learn-method/4/"
                    },
                    "version_group": {
                        "name": "sun-moon",
                        "url": "http://localhost/api/v2/version-group/17/"
                    }
                },
                {
                    "level_learned_at": 0,
                    "move_learn_method": {
                        "name": "machine",
                        "url": "http://localhost/api/v2/move-learn-method/4/"
                    },
                    "version_group": {
                        "name": "omega-ruby-alpha-sapphire",
                        "url": "http://localhost/api/v2/version-group/16/"
                    }
                }
            ]
        },
        {
            "move": {
                "name": "blizzard",
                "url": "http://localhost/api/v2/move/59/"
            },
            "version_group_details": [
                {
                    "level_learned_at": 0,
                    "move_learn_method": {
                        "name": "machine",
                        "url": "http://localhost/api/v2/move-learn-method/4/"
                    },
                    "version_group": {
                        "name": "sun-moon",
                        "url": "http://localhost/api/v2/version-group/17/"
                    }
                },
                {
                    "level_learned_at": 0,
                    "move_learn_method": {
                        "name": "machine",
                        "url": "http://localhost/api/v2/move-learn-method/4/"
                    },
                    "version_group": {